{
  "schema_version": "1.0",
  "candidate": {
    "name": "Alex",
    "emails": [],
    "phones": [],
    "links": [],
    "education": [],
    "experience": []
  },
  "extracted_skills": [
    {
      "raw": "JS",
      "start": 19,
      "end": 21
    },
    {
      "raw": "React.js",
      "start": 23,
      "end": 31
    },
    {
      "raw": "NodeJS",
      "start": 33,
      "end": 39
    },
    {
      "raw": "Postgres",
      "start": 41,
      "end": 49
    },
    {
      "raw": "Git",
      "start": 51,
      "end": 54
    }
  ],
  "excluded_mentions": [],
  "warnings": [],
  "normalized_skills": [
    "GIT",
    "JAVASCRIPT",
    "NODE_JS",
    "POSTGRESQL",
    "REACT"
  ],
  "normalization_evidence": [
    {
      "extracted_index": 0,
      "canonical": "JAVASCRIPT"
    },
    {
      "extracted_index": 1,
      "canonical": "REACT"
    },
    {
      "extracted_index": 2,
      "canonical": "NODE_JS"
    },
    {
      "extracted_index": 3,
      "canonical": "POSTGRESQL"
    },
    {
      "extracted_index": 4,
      "canonical": "GIT"
    }
  ],
  "unknown_skills": []
}
