{
  "schema_version": "1.0",
  "candidate": {
    "name": "Eva Reference",
    "emails": [],
    "phones": [],
    "links": [],
    "education": [],
    "experience": []
  },
  "extracted_skills": [
    {
      "raw": "Python",
      "start": 28,
      "end": 34
    },
    {
      "raw": "NumPy",
      "start": 36,
      "end": 41
    },
    {
      "raw": "SQL",
      "start": 43,
      "end": 46
    },
    {
      "raw": "Git",
      "start": 48,
      "end": 51
    }
  ],
  "excluded_mentions": [
    {
      "raw": "sklearn",
      "start": 67,
      "end": 74,
      "reason": "Explicit simple negation"
    }
  ],
  "warnings": [],
  "normalized_skills": [
    "GIT",
    "NUMPY",
    "PYTHON",
    "SQL"
  ],
  "normalization_evidence": [
    {
      "extracted_index": 0,
      "canonical": "PYTHON"
    },
    {
      "extracted_index": 1,
      "canonical": "NUMPY"
    },
    {
      "extracted_index": 2,
      "canonical": "SQL"
    },
    {
      "extracted_index": 3,
      "canonical": "GIT"
    }
  ],
  "unknown_skills": []
}
